{
  "schema_version": "1.0",
  "message_type": "rollback_event",
  "created_at": "2026-07-18T10:08:00Z",
  "safety_flags": {
    "synthetic_local_only": true,
    "mock_only": true,
    "dry_run": true,
    "owner_review_required": true,
    "external_side_effects_allowed": false,
    "external_side_effects_occurred": false,
    "blackboard_write_allowed": false,
    "queue_write_allowed": false,
    "audit_trail_write_allowed": false,
    "worker_dispatch_allowed": false,
    "openclaw_call_allowed": false,
    "hermes_runtime_allowed": false,
    "connector_call_allowed": false,
    "google_sheets_write_allowed": false,
    "follow_up_allowed": false,
    "follow_up_requires_owner_confirmation": true
  },
  "prev_entry_hash": "2222222222222222222222222222222222222222222222222222222222222222",
  "execution_class": "AUTO",
  "produced_by": "rollback-preview-builder",
  "parent_task_id": null,
  "role": "rollback_reviewer",
  "rollback_id": "rollback-phase3-001",
  "task_id": "task-phase3-001",
  "related_result_id": "result-phase3-001",
  "source_audit_id": "audit-phase3-001",
  "rollback_status": "NOT_REQUIRED",
  "rollback_required": false,
  "preview_only": true,
  "rollback_note": "No rollback is needed because no execution occurred.",
  "rollback_path": null,
  "reason": "The synthetic command envelope was never dispatched."
}
